{
  "schemaVersion": "finance.runtime-build-requirements.v2",
  "requestId": "task-build-example-v2",
  "source": {
    "assetId": "candidate-example-v2",
    "artifactSha256": "767192dde9979bfb4fdc475d994a519d84748beaee724067a276c71fb491eda6"
  },
  "target": {
    "runtimeType": "openjiuwen",
    "protocols": {
      "capabilities": "finance.skill-eval.runtime-capabilities.v1",
      "instance": "finance.skill-eval.runtime-instance.v2",
      "execution": "finance.skill-eval.runtime-case.v1",
      "observation": "finance.runtime-observation.v1"
    }
  },
  "requiredCapabilities": [],
  "requirementsDigest": "f58caf7ea37960ebe55ae226b91c057bf165cfc97563069d60aecbac41a4d0a0",
  "extensions": {
    "migrationTask": {
      "schemaVersion": "finance.migration-task-build-profile.v2",
      "required": true,
      "taskId": "bundle-example",
      "sourceDigest": "767192dde9979bfb4fdc475d994a519d84748beaee724067a276c71fb491eda6",
      "candidateId": "candidate-example-v2",
      "candidateDigest": "767192dde9979bfb4fdc475d994a519d84748beaee724067a276c71fb491eda6",
      "goal": "Complete procurement review",
      "target": "OpenJiuwen",
      "instanceSchemaVersion": "finance.skill-eval.runtime-instance.v2",
      "multiSkill": true,
      "settings": {
        "timeoutMs": 300000,
        "harnessTools": [
          "read_file",
          "glob",
          "list_files"
        ]
      },
      "services": [],
      "files": [
        "skills/policy/SKILL.md"
      ],
      "skills": [
        {
          "id": "skill-1",
          "skillId": "policy",
          "skillFile": "skills/policy/SKILL.md",
          "version": "r1",
          "artifactSha256": "767192dde9979bfb4fdc475d994a519d84748beaee724067a276c71fb491eda6"
        }
      ]
    }
  }
}
